{
  "version": 1,
  "slots": {
    "lesson-defi-overview": 0,
    "lesson-amm-concepts": 1,
    "lesson-lending-concepts": 2,
    "lesson-amm-challenge": 3,
    "lesson-token-standards": 4,
    "lesson-token-math-challenge": 5,
    "lesson-staking-mechanisms": 6,
    "lesson-staking-challenge": 7,
    "lesson-orderbook-design": 8,
    "lesson-oracle-design": 9,
    "lesson-vault-challenge": 10,
    "lesson-liquidation-challenge": 11
  },
  "retired": [],
  "next": 12
}
