{
  "version": 1,
  "slots": {
    "lesson-mav2-m01-l1": 0,
    "lesson-mav2-m01-l2": 1,
    "lesson-mav2-m01-l3": 2,
    "lesson-mav2-m01-l4": 3,
    "lesson-mav2-m02-l1": 4,
    "lesson-mav2-m02-l2": 5,
    "lesson-mav2-m02-l3": 6,
    "lesson-mav2-m03-l1": 7,
    "lesson-mav2-m03-l2": 8,
    "lesson-mav2-m03-l3": 9,
    "lesson-mav2-m04-l1": 10,
    "lesson-mav2-m04-l2": 11,
    "lesson-mav2-m04-l3": 12,
    "lesson-mav2-m05-l1": 13,
    "lesson-mav2-m05-l2": 14,
    "lesson-mav2-m05-l3": 15,
    "lesson-mav2-m06-l1": 16,
    "lesson-mav2-m06-l2": 17,
    "lesson-mav2-m07-l1": 18,
    "lesson-mav2-m07-l2": 19,
    "lesson-mav2-m07-l3": 20,
    "lesson-mav2-m08-l1": 21,
    "lesson-mav2-m08-l2": 22,
    "lesson-mav2-m09-l1": 23,
    "lesson-mav2-m09-l2": 24,
    "lesson-mav2-m09-l3": 25,
    "lesson-mav2-m10-l1": 26,
    "lesson-mav2-m10-l2": 27,
    "lesson-mav2-m10-l3": 28,
    "lesson-mav2-m10-l4": 29
  },
  "retired": [],
  "next": 30
}
