{
  "version": 1,
  "slots": {
    "lesson-wallet-adapter-intro": 0,
    "lesson-connect-wallet-challenge": 1,
    "lesson-signing-messages": 2,
    "lesson-sign-message-challenge": 3,
    "lesson-rpc-methods": 4,
    "lesson-balance-checker-challenge": 5,
    "lesson-parsing-data": 6,
    "lesson-parse-data-challenge": 7,
    "lesson-react-patterns": 8,
    "lesson-transaction-ui": 9,
    "lesson-notifications": 10,
    "lesson-dapp-challenge": 11
  },
  "retired": [],
  "next": 12
}
