{
  "version": 1,
  "slots": {
    "lesson-bfsp-from-code-to-chain": 0,
    "lesson-bfsp-your-first-build": 1,
    "lesson-bfsp-anatomy-anchor-program": 2,
    "lesson-bfsp-add-instruction": 3,
    "lesson-bfsp-on-chain-state": 4,
    "lesson-bfsp-define-counter": 5,
    "lesson-bfsp-account-constraints": 6,
    "lesson-bfsp-wire-up-initialize": 7,
    "lesson-bfsp-adding-instructions": 8,
    "lesson-bfsp-build-increment": 9,
    "lesson-bfsp-complete-counter": 10,
    "lesson-bfsp-deploy-to-devnet": 11,
    "lesson-bfsp-m4-airdrop": 12,
    "lesson-bfsp-m4-deploy": 13,
    "lesson-bfsp-m4-interact": 14,
    "lesson-bfsp-m4-capstone": 15
  },
  "retired": [],
  "next": 16
}
