{
  "version": 1,
  "slots": {
    "lesson-why-rust": 0,
    "lesson-ownership-borrowing": 1,
    "lesson-structs-enums": 2,
    "lesson-rust-basics-challenge": 3,
    "lesson-serialization": 4,
    "lesson-serialization-challenge": 5,
    "lesson-error-handling": 6,
    "lesson-error-challenge": 7,
    "lesson-program-structure": 8,
    "lesson-rust-program-challenge": 9,
    "lesson-state-management": 10,
    "lesson-pda-challenge": 11
  },
  "retired": [],
  "next": 12
}
