{
  "version": 1,
  "slots": {
    "lesson-intro-solana": 0,
    "lesson-setup-environment": 1,
    "lesson-wallet-setup": 2,
    "lesson-keypair-challenge": 3,
    "lesson-first-transaction": 4,
    "lesson-transfer-challenge": 5,
    "lesson-token-overview": 6,
    "lesson-create-token-challenge": 7,
    "lesson-account-model": 8,
    "lesson-account-challenge": 9,
    "lesson-programs-overview": 10,
    "lesson-program-challenge": 11
  },
  "retired": [],
  "next": 12
}
