{
  "version": 1,
  "slots": {
    "lesson-rtf-m01-l1": 0,
    "lesson-rtf-m01-l2": 1,
    "lesson-rtf-m01-l3": 2,
    "lesson-rtf-m02-l1": 3,
    "lesson-rtf-m02-l2": 4,
    "lesson-rtf-m02-l3": 5,
    "lesson-rtf-m02-l4": 6,
    "lesson-rtf-m03-l1": 7,
    "lesson-rtf-m03-l2": 8,
    "lesson-rtf-m03-l3": 9,
    "lesson-rtf-m03-l4": 10,
    "lesson-rtf-m04-l1": 11,
    "lesson-rtf-m04-l2": 12,
    "lesson-rtf-m04-l3": 13,
    "lesson-rtf-m05-l1": 14,
    "lesson-rtf-m05-l2": 15,
    "lesson-rtf-m05-l3": 16,
    "lesson-rtf-m06-l1": 17,
    "lesson-rtf-m06-l2": 18,
    "lesson-rtf-m06-l3": 19,
    "lesson-rtf-m06-l4": 20,
    "lesson-rtf-m07-l1": 21,
    "lesson-rtf-m07-l2": 22,
    "lesson-rtf-m08-l1": 23,
    "lesson-rtf-m08-l2": 24,
    "lesson-rtf-m08-l3": 25,
    "lesson-rtf-m08-l4": 26,
    "lesson-rtf-m09-l1": 27,
    "lesson-rtf-m09-l2": 28,
    "lesson-rtf-m10-l1": 29,
    "lesson-rtf-m10-l2": 30
  },
  "retired": [],
  "next": 31
}
