{
  "version": 1,
  "slots": {
    "lesson-anchor-intro": 0,
    "lesson-anchor-setup-challenge": 1,
    "lesson-anchor-accounts": 2,
    "lesson-anchor-accounts-challenge": 3,
    "lesson-pda-deep-dive": 4,
    "lesson-pda-advanced-challenge": 5,
    "lesson-cpi-overview": 6,
    "lesson-cpi-challenge": 7,
    "lesson-anchor-testing": 8,
    "lesson-anchor-errors": 9,
    "lesson-deployment": 10,
    "lesson-testing-challenge": 11
  },
  "retired": [],
  "next": 12
}
