{
  "version": 1,
  "slots": {
    "lesson-spc-m01-l1": 0,
    "lesson-spc-m01-l2": 1,
    "lesson-spc-m02-l1": 2,
    "lesson-spc-m02-l2": 3,
    "lesson-spc-m03-l1": 4,
    "lesson-spc-m03-l2": 5,
    "lesson-spc-m03-l3": 6,
    "lesson-spc-m03-l4": 7,
    "lesson-spc-m04-l1": 8,
    "lesson-spc-m04-l2": 9,
    "lesson-spc-m04-l3": 10,
    "lesson-spc-m05-l1": 11,
    "lesson-spc-m05-l2": 12,
    "lesson-spc-m05-l3": 13,
    "lesson-spc-m06-l1": 14,
    "lesson-spc-m06-l2": 15,
    "lesson-spc-m07-l1": 16,
    "lesson-spc-m07-l2": 17,
    "lesson-spc-m07-l3": 18,
    "lesson-spc-m08-l1": 19,
    "lesson-spc-m08-l2": 20,
    "lesson-spc-m08-l3": 21,
    "lesson-spc-m09-l1": 22,
    "lesson-spc-m09-l2": 23
  },
  "retired": [],
  "next": 24
}
