{
  "version": 1,
  "slots": {
    "lesson-date-m01-l1-what-is-this-token": 0,
    "lesson-date-m01-l2-mint-account-anatomy": 1,
    "lesson-date-m01-l3-p-token-switch": 2,
    "lesson-date-m01-l4-decision-framework-conflict-matrix": 3,
    "lesson-date-m02-l1-economics-extensions": 4,
    "lesson-date-m02-l2-authority-extensions": 5,
    "lesson-date-m02-l3-holder-protection-extensions": 6,
    "lesson-date-m02-l4-native-metadata": 7,
    "lesson-date-m03-l1-write-the-hook": 8,
    "lesson-date-m03-l2-resolving-hooks-composability": 9,
    "lesson-date-m04-l1-confidential-model": 10,
    "lesson-date-m04-l2-issuer-ops": 11,
    "lesson-date-m05-l1-dex-allowlist-artifact": 12,
    "lesson-date-m05-l2-designing-routable-token": 13,
    "lesson-date-m06-l1-metadata-standards": 14,
    "lesson-date-m06-l2-metaplex-core": 15,
    "lesson-date-m06-l3-token-metadata-legacy": 16,
    "lesson-date-m07-l1-bubblegum-v2-cnfts": 17,
    "lesson-date-m07-l2-reading-assets-das": 18,
    "lesson-date-m07-l3-zk-compression-frontier": 19,
    "lesson-date-m08-l1-bonding-curves-graduation": 20,
    "lesson-date-m08-l2-launchpad-landscape": 21,
    "lesson-date-m08-l3-airdrops-at-scale": 22,
    "lesson-date-m09-l1-fee-routing-buyback": 23,
    "lesson-date-m09-l2-gating-migrations": 24,
    "lesson-date-m09-l3-production-case-studies": 25,
    "lesson-date-m10-l1-capstone-choose-primitive": 26,
    "lesson-date-m10-l2-cumulative-checkpoint-close": 27
  },
  "retired": [],
  "next": 28
}
